{
  "meta": {
    "analysis_id": "a4672fc6-dabf-48ec-9c18-db4f39a951a3",
    "timestamp": "2025-12-29T10:13:43.613746",
    "category": "List Comprehension",
    "topic": "Replace negative numbers with 0"
  },
  "scores": {
    "pylint_score": 10.0,
    "complexity_score": 7.0,
    "loc_score": 10.0,
    "structural_score": 5.0,
    "logic_score": 9.0,
    "cyclomatic_score": 9.0,
    "mi_score": 6.41,
    "composite_score": 8.47
  },
  "raw_outputs": {
    "pylint": "--------------------------------------------------------------------\nYour code has been rated at 10.00/10 (previous run: 10.00/10, +0.00)",
    "ast": [
      "Variable `calculate_factorial_iterative` used before assignment (line 13).",
      "Variable `n` used before assignment (line 2).",
      "Variable `n` used before assignment (line 4).",
      "Variable `i` used before assignment (line 9).",
      "Variable `n` used before assignment (line 8)."
    ],
    "math_llm": "No mathematical issues found or the model returned an empty response.",
    "complexity_llm": "time_complexity: O(n),\nspace_complexity: O(1),\nexplanation: The time complexity, denoted as 'O(n)', arises because the function iterates through each value from 1 to n exactly once. Therefore, if we doubled the input size (num becomes num * 2), it would approximately require twice the number of operations for calculation; this illustrates linear growth relative to input size with respect to time complexity\u2014hence O(n). The space complexity is denoted as 'O(1)' because no matter how large n gets, our function's memory footprint doesn\u2019t grow (we are not using any additional data structures that would scale with the input; therefore it stays constant), and only a fixed number of variables like `if`, `factorial`, and loop counters exist.\nefficiency_score: 7"
  },
  "final_report": "\nCODE ANALYSIS REPORT\n-----------------------------------------------\nLINES OF CODE: 13\nFunctions: 1\nClasses: 0\n\nScore: 10/10\n\n---------- STRUCTURAL ERRORS (AST) ----------\nVariable `calculate_factorial_iterative` used before assignment (line 13).\nVariable `n` used before assignment (line 2).\nVariable `n` used before assignment (line 4).\nVariable `i` used before assignment (line 9).\nVariable `n` used before assignment (line 8).\n\nScore: 5.0/10\n\n---------- PYLINT ----------\n--------------------------------------------------------------------\nYour code has been rated at 10.00/10 (previous run: 10.00/10, +0.00)\n\nScore: 10.0/10\n\n---------- CYCLOMATIC COMPLEXITY ----------\nGrade: A\nScore: 4.0\nRemarks: CC Range (1-5): Very simple and clear.\n\n---------- MAINTAINABILITY INDEX ----------\nGrade: A\nScore: 64.1\nRemarks: MI Range (65-100): Highly maintainable \u2014 clean and simple\n\n---------- MATHEMATICAL / ALGORITHMIC ERRORS (LLM) ----------\nNo mathematical issues found or the model returned an empty response.\n\n---------- TIME/SPACE COMPLEXITY & READABILITY ----------\ntime_complexity: O(n),\nspace_complexity: O(1),\nexplanation: The time complexity, denoted as 'O(n)', arises because the function iterates through each value from 1 to n exactly once. Therefore, if we doubled the input size (num becomes num * 2), it would approximately require twice the number of operations for calculation; this illustrates linear growth relative to input size with respect to time complexity\u2014hence O(n). The space complexity is denoted as 'O(1)' because no matter how large n gets, our function's memory footprint doesn\u2019t grow (we are not using any additional data structures that would scale with the input; therefore it stays constant), and only a fixed number of variables like `if`, `factorial`, and loop counters exist.\nefficiency_score: 7\n\n---------- COMPOSITE SCORE FOR YOUR CODE ----------\n8.47\n\n--------------------------------------------\n"
}