{
  "meta": {
    "analysis_id": "0e19d325-d0ce-4d8e-b75c-c9616d424f8a",
    "timestamp": "2025-12-30T06:34:22.957512",
    "category": "Graph",
    "topic": "Shortest path (basic Dijkstra)"
  },
  "scores": {
    "pylint_score": 9.41,
    "complexity_score": 7.0,
    "loc_score": 6.0,
    "structural_score": 0.0,
    "logic_score": 8.0,
    "cyclomatic_score": 8.0,
    "mi_score": 6.13,
    "composite_score": 7.51
  },
  "raw_outputs": {
    "pylint": "************* Module temp_code\ntemp_code.py:3:13: W0621: Redefining name 'graph' from outer scope (line 24) (redefined-outer-name)\n\n------------------------------------------------------------------\nYour code has been rated at 9.41/10 (previous run: 9.41/10, +0.00)",
    "ast": [
      "Variable `node` used before assignment (line 4).",
      "Variable `start` used before assignment (line 5).",
      "Variable `dijkstra` used before assignment (line 31).",
      "Variable `start` used before assignment (line 6).",
      "Variable `current_distance` used before assignment (line 11).",
      "Variable `current_node` used before assignment (line 14).",
      "Variable `heapq` used before assignment (line 9).",
      "Variable `current_node` used before assignment (line 11).",
      "Variable `current_distance` used before assignment (line 15).",
      "Variable `weight` used before assignment (line 15).",
      "Variable `neighbor` used before assignment (line 17).",
      "Variable `neighbor` used before assignment (line 18).",
      "Variable `heapq` used before assignment (line 19).",
      "Variable `neighbor` used before assignment (line 19)."
    ],
    "math_llm": "No mathematical issues found or the model returned an empty response.",
    "complexity_llm": "time_complexity: O((V+E) * log V),\nspace_complexity: O(V), where V is the number of vertices and E is the number of edges in the graph. The explanation for time complexity involves using a priority queue (heapq implementation in Python which has insertion and removal complexities both as O(log V)), so each vertex will be processed once, with nested iterations over its neighbors leading to at most two operations per edge traversal inside the while loop. Hence, every node is enqueued and dequeued a total of E+V times in the worst case scenario; thus giving us (E + V) log(V).\n\nThe space complexity takes into account that each vertex's distance needs to be stored at least once for all vertices except the start which doesn\u2019t need its value. Thus, it is O(V), where we consider only the number of nodes in terms of memory storage without taking edge weights and priority queue implementation complexities as they are typically constant or logarithmic with respect to V (depending on Python's heapq behavior).\n\nThe Dijkstra algorithm using a min-heap is an efficient approach for finding the shortest path between two nodes in graphs that do not have negative weight edges, but it can become suboptimal when dealing with large dense graphs or many edge recalculations. The efficiency score of this implementation would be 7 out of 10 as while Dijkstra\u2019s algorithm is efficient and widely used for sparse to moderately sized graphs without cycles (where all weights are non-negative), it's not the best choice when there are negative weight edges present, where Bellman\u2013Ford or Johnson\u2019s algorithms might perform better. Nonetheless, given that this question seems theoretical with a focus on efficiency analysis and Big O notation rather than actual performance benchmarking in code execution time for specific input sizes/types, we rate it as 7 out of 10 based on its general applicability to many scenarios where negative weights are not present.\n\nexplanation: The provided Python implementation uses Dijkstra's algorithm with a priority queue (min-heap) implemented by the `heapq` module for selecting nodes with minimum tentative distance in each iteration of finding shortest paths from the start node to all others in an undirected weighted graph without negative weights. The use of heap allows extracting and updating only necessary elements per level, which typically makes it faster than a naive selection/enqueue method where every edge is processed repeatedly regardless if its distance was updated or not beforehand; however, the insertion into priority queue dominated by O(log V) operation may become less efficient for very dense graphs.\n\nefficiency_score: 7"
  },
  "final_report": "\nCODE ANALYSIS REPORT\n-----------------------------------------------\nLINES OF CODE: 22\nFunctions: 1\nClasses: 0\n\nScore: 6.0/10\n\n---------- STRUCTURAL ERRORS (AST) ----------\nVariable `node` used before assignment (line 4).\nVariable `start` used before assignment (line 5).\nVariable `dijkstra` used before assignment (line 31).\nVariable `start` used before assignment (line 6).\nVariable `current_distance` used before assignment (line 11).\nVariable `current_node` used before assignment (line 14).\nVariable `heapq` used before assignment (line 9).\nVariable `current_node` used before assignment (line 11).\nVariable `current_distance` used before assignment (line 15).\nVariable `weight` used before assignment (line 15).\nVariable `neighbor` used before assignment (line 17).\nVariable `neighbor` used before assignment (line 18).\nVariable `heapq` used before assignment (line 19).\nVariable `neighbor` used before assignment (line 19).\n\nScore: 0.0/10\n\n---------- PYLINT ----------\n************* Module temp_code\ntemp_code.py:3:13: W0621: Redefining name 'graph' from outer scope (line 24) (redefined-outer-name)\n\n------------------------------------------------------------------\nYour code has been rated at 9.41/10 (previous run: 9.41/10, +0.00)\n\nScore: 9.41/10\n\n---------- CYCLOMATIC COMPLEXITY ----------\nGrade: B\nScore: 6.0\nRemarks: CC Range (6-10): Slight complexity.\n\n---------- MAINTAINABILITY INDEX ----------\nGrade: A\nScore: 61.28\nRemarks: MI Range (65-100): Highly maintainable \u2014 clean and simple\n\n---------- MATHEMATICAL / ALGORITHMIC ERRORS (LLM) ----------\nNo mathematical issues found or the model returned an empty response.\n\n---------- TIME/SPACE COMPLEXITY & READABILITY ----------\ntime_complexity: O((V+E) * log V),\nspace_complexity: O(V), where V is the number of vertices and E is the number of edges in the graph. The explanation for time complexity involves using a priority queue (heapq implementation in Python which has insertion and removal complexities both as O(log V)), so each vertex will be processed once, with nested iterations over its neighbors leading to at most two operations per edge traversal inside the while loop. Hence, every node is enqueued and dequeued a total of E+V times in the worst case scenario; thus giving us (E + V) log(V).\n\nThe space complexity takes into account that each vertex's distance needs to be stored at least once for all vertices except the start which doesn\u2019t need its value. Thus, it is O(V), where we consider only the number of nodes in terms of memory storage without taking edge weights and priority queue implementation complexities as they are typically constant or logarithmic with respect to V (depending on Python's heapq behavior).\n\nThe Dijkstra algorithm using a min-heap is an efficient approach for finding the shortest path between two nodes in graphs that do not have negative weight edges, but it can become suboptimal when dealing with large dense graphs or many edge recalculations. The efficiency score of this implementation would be 7 out of 10 as while Dijkstra\u2019s algorithm is efficient and widely used for sparse to moderately sized graphs without cycles (where all weights are non-negative), it's not the best choice when there are negative weight edges present, where Bellman\u2013Ford or Johnson\u2019s algorithms might perform better. Nonetheless, given that this question seems theoretical with a focus on efficiency analysis and Big O notation rather than actual performance benchmarking in code execution time for specific input sizes/types, we rate it as 7 out of 10 based on its general applicability to many scenarios where negative weights are not present.\n\nexplanation: The provided Python implementation uses Dijkstra's algorithm with a priority queue (min-heap) implemented by the `heapq` module for selecting nodes with minimum tentative distance in each iteration of finding shortest paths from the start node to all others in an undirected weighted graph without negative weights. The use of heap allows extracting and updating only necessary elements per level, which typically makes it faster than a naive selection/enqueue method where every edge is processed repeatedly regardless if its distance was updated or not beforehand; however, the insertion into priority queue dominated by O(log V) operation may become less efficient for very dense graphs.\n\nefficiency_score: 7\n\n---------- COMPOSITE SCORE FOR YOUR CODE ----------\n7.51\n\n--------------------------------------------\n"
}