{
  "meta": {
    "analysis_id": "644f4742-8147-41e8-8195-9739ab60bca9",
    "timestamp": "2025-12-30T06:56:33.337327",
    "category": "Graph",
    "topic": "Shortest path (basic Dijkstra)"
  },
  "scores": {
    "pylint_score": 9.41,
    "complexity_score": 9.0,
    "loc_score": 6.0,
    "structural_score": 0.0,
    "logic_score": 8.0,
    "cyclomatic_score": 8.0,
    "mi_score": 6.13,
    "composite_score": 8.01
  },
  "raw_outputs": {
    "pylint": "************* Module temp_code\ntemp_code.py:3:13: W0621: Redefining name 'graph' from outer scope (line 24) (redefined-outer-name)\n\n------------------------------------------------------------------\nYour code has been rated at 9.41/10 (previous run: 9.41/10, +0.00)",
    "ast": [
      "Variable `node` used before assignment (line 4).",
      "Variable `start` used before assignment (line 5).",
      "Variable `dijkstra` used before assignment (line 31).",
      "Variable `start` used before assignment (line 6).",
      "Variable `current_distance` used before assignment (line 11).",
      "Variable `current_node` used before assignment (line 14).",
      "Variable `heapq` used before assignment (line 9).",
      "Variable `current_node` used before assignment (line 11).",
      "Variable `current_distance` used before assignment (line 15).",
      "Variable `weight` used before assignment (line 15).",
      "Variable `neighbor` used before assignment (line 17).",
      "Variable `neighbor` used before assignment (line 18).",
      "Variable `heapq` used before assignment (line 19).",
      "Variable `neighbor` used before assignment (line 19)."
    ],
    "math_llm": "No mathematical issues found or the model returned an empty response.",
    "complexity_llm": "time_complexity: O((V+E)*log(V)), where V is the number of vertices and E is the number of edges in the graph. The heap operations (heappop and heappush) are performed once for each vertex; thus it's proportional to both the size of the vertex set and edge set, with log(V) complexity due to using a priority queue implemented as a binary heap.\n\nspace_complexity: O(V). The algorithm only uses a constant amount of space beyond that required by input graph (other than recursion depth); it needs extra storage for distances and visited vertices in the priority queue at most V elements, where each element is typically an integer or floating-point number representing distance. \n\nexplanation: Dijkstra's algorithm finds the shortest path from a single source to all other nodes in a weighted graph without negative weights using a greedy approach and prioritizing vertices with minimum tentative distances for exploration through priority queue (min heap). The time complexity is determined by both iterating over each vertex, which results in O(V) iterations as the most complex operation within loops. Each iteration involves extracting from or inserting into the min-heap implemented using a binary heap data structure; these operations are logarithmic with respect to V (O(log V)) for best cases and average case but degrade gracefully towards linear time complexity O(V) in the worst case when nearly all elements of vertices need exploration, thus overall it's often stated as O((V+E)*log(V)). The space complexity is determined by the storage needed to maintain tentative distances for each vertex and priority queue; both are proportional to V (O(V)), assuming integer or float representations.\n\nefficiency_score: 9"
  },
  "final_report": "\nCODE ANALYSIS REPORT\n-----------------------------------------------\nLINES OF CODE: 22\nFunctions: 1\nClasses: 0\n\nScore: 6.0/10\n\n---------- STRUCTURAL ERRORS (AST) ----------\nVariable `node` used before assignment (line 4).\nVariable `start` used before assignment (line 5).\nVariable `dijkstra` used before assignment (line 31).\nVariable `start` used before assignment (line 6).\nVariable `current_distance` used before assignment (line 11).\nVariable `current_node` used before assignment (line 14).\nVariable `heapq` used before assignment (line 9).\nVariable `current_node` used before assignment (line 11).\nVariable `current_distance` used before assignment (line 15).\nVariable `weight` used before assignment (line 15).\nVariable `neighbor` used before assignment (line 17).\nVariable `neighbor` used before assignment (line 18).\nVariable `heapq` used before assignment (line 19).\nVariable `neighbor` used before assignment (line 19).\n\nScore: 0.0/10\n\n---------- PYLINT ----------\n************* Module temp_code\ntemp_code.py:3:13: W0621: Redefining name 'graph' from outer scope (line 24) (redefined-outer-name)\n\n------------------------------------------------------------------\nYour code has been rated at 9.41/10 (previous run: 9.41/10, +0.00)\n\nScore: 9.41/10\n\n---------- CYCLOMATIC COMPLEXITY ----------\nGrade: B\nScore: 6.0\nRemarks: CC Range (6-10): Slight complexity.\n\n---------- MAINTAINABILITY INDEX ----------\nGrade: A\nScore: 61.28\nRemarks: MI Range (65-100): Highly maintainable \u2014 clean and simple\n\n---------- MATHEMATICAL / ALGORITHMIC ERRORS (LLM) ----------\nNo mathematical issues found or the model returned an empty response.\n\n---------- TIME/SPACE COMPLEXITY & READABILITY ----------\ntime_complexity: O((V+E)*log(V)), where V is the number of vertices and E is the number of edges in the graph. The heap operations (heappop and heappush) are performed once for each vertex; thus it's proportional to both the size of the vertex set and edge set, with log(V) complexity due to using a priority queue implemented as a binary heap.\n\nspace_complexity: O(V). The algorithm only uses a constant amount of space beyond that required by input graph (other than recursion depth); it needs extra storage for distances and visited vertices in the priority queue at most V elements, where each element is typically an integer or floating-point number representing distance. \n\nexplanation: Dijkstra's algorithm finds the shortest path from a single source to all other nodes in a weighted graph without negative weights using a greedy approach and prioritizing vertices with minimum tentative distances for exploration through priority queue (min heap). The time complexity is determined by both iterating over each vertex, which results in O(V) iterations as the most complex operation within loops. Each iteration involves extracting from or inserting into the min-heap implemented using a binary heap data structure; these operations are logarithmic with respect to V (O(log V)) for best cases and average case but degrade gracefully towards linear time complexity O(V) in the worst case when nearly all elements of vertices need exploration, thus overall it's often stated as O((V+E)*log(V)). The space complexity is determined by the storage needed to maintain tentative distances for each vertex and priority queue; both are proportional to V (O(V)), assuming integer or float representations.\n\nefficiency_score: 9\n\n---------- COMPOSITE SCORE FOR YOUR CODE ----------\n8.01\n\n--------------------------------------------\n"
}