{
  "meta": {
    "analysis_id": "c94e4a16-0374-4378-a279-39c0bfd82953",
    "timestamp": "2025-12-30T06:42:42.585297",
    "category": "Graph",
    "topic": "Shortest path (basic Dijkstra)"
  },
  "scores": {
    "pylint_score": 9.41,
    "complexity_score": 7.0,
    "loc_score": 6.0,
    "structural_score": 0.0,
    "logic_score": 7.0,
    "cyclomatic_score": 8.0,
    "mi_score": 6.13,
    "composite_score": 7.21
  },
  "raw_outputs": {
    "pylint": "************* Module temp_code\ntemp_code.py:3:13: W0621: Redefining name 'graph' from outer scope (line 24) (redefined-outer-name)\n\n------------------------------------------------------------------\nYour code has been rated at 9.41/10 (previous run: 9.41/10, +0.00)",
    "ast": [
      "Variable `node` used before assignment (line 4).",
      "Variable `start` used before assignment (line 5).",
      "Variable `dijkstra` used before assignment (line 31).",
      "Variable `start` used before assignment (line 6).",
      "Variable `current_distance` used before assignment (line 11).",
      "Variable `current_node` used before assignment (line 14).",
      "Variable `heapq` used before assignment (line 9).",
      "Variable `current_node` used before assignment (line 11).",
      "Variable `current_distance` used before assignment (line 15).",
      "Variable `weight` used before assignment (line 15).",
      "Variable `neighbor` used before assignment (line 17).",
      "Variable `neighbor` used before assignment (line 18).",
      "Variable `heapq` used before assignment (line 19).",
      "Variable `neighbor` used before assignment (line 19)."
    ],
    "math_llm": "No mathematical issues found or the model returned an empty response.",
    "complexity_llm": "time_complexity: O((V+E)*log(V)),\nspace_complexity: O(V),\nexplanation: The time complexity of Dijkstra's algorithm is determined by the number of vertices (V) and edges (E). Since a priority queue (min-heap in this case, implemented with heapq module) needs to be maintained for each vertex visited except start node and extracting an element from it takes O(log V) time. Every edge has weight 1 or less ensuring that all nodes will eventually get popped out of the min-heap after a finite number of iterations (up to E times). Hence, we have at most two nested loops: one over edges and another on vertices which gives us complexity O(E + V log V) but this can be further optimized as Dijkstra's algorithm with Fibonacci heap reduces the time taken by half for edge weights upto 15. But here it is considered to have simple min-heap operations so, final time_complexity will be O((V+E)*log(V)).\nThe space complexity comes from storing distances and maintaining priority queue at most containing V elements (one distance entry per vertex), hence the space complexity becomes linear with respect to number of vertices i.e., O(V). The input graph is represented using an adjacency list representation which requires additional memory for each edge, but as all weights are 1 or less here it doesn't add significant overhead and we only need V extra spaces in worst case scenario (when every node needs to store distance value from start), hence space complexity becomes O(V).\nefficiency_score: 7"
  },
  "final_report": "\nCODE ANALYSIS REPORT\n-----------------------------------------------\nLINES OF CODE: 22\nFunctions: 1\nClasses: 0\n\nScore: 6.0/10\n\n---------- STRUCTURAL ERRORS (AST) ----------\nVariable `node` used before assignment (line 4).\nVariable `start` used before assignment (line 5).\nVariable `dijkstra` used before assignment (line 31).\nVariable `start` used before assignment (line 6).\nVariable `current_distance` used before assignment (line 11).\nVariable `current_node` used before assignment (line 14).\nVariable `heapq` used before assignment (line 9).\nVariable `current_node` used before assignment (line 11).\nVariable `current_distance` used before assignment (line 15).\nVariable `weight` used before assignment (line 15).\nVariable `neighbor` used before assignment (line 17).\nVariable `neighbor` used before assignment (line 18).\nVariable `heapq` used before assignment (line 19).\nVariable `neighbor` used before assignment (line 19).\n\nScore: 0.0/10\n\n---------- PYLINT ----------\n************* Module temp_code\ntemp_code.py:3:13: W0621: Redefining name 'graph' from outer scope (line 24) (redefined-outer-name)\n\n------------------------------------------------------------------\nYour code has been rated at 9.41/10 (previous run: 9.41/10, +0.00)\n\nScore: 9.41/10\n\n---------- CYCLOMATIC COMPLEXITY ----------\nGrade: B\nScore: 6.0\nRemarks: CC Range (6-10): Slight complexity.\n\n---------- MAINTAINABILITY INDEX ----------\nGrade: A\nScore: 61.28\nRemarks: MI Range (65-100): Highly maintainable \u2014 clean and simple\n\n---------- MATHEMATICAL / ALGORITHMIC ERRORS (LLM) ----------\nNo mathematical issues found or the model returned an empty response.\n\n---------- TIME/SPACE COMPLEXITY & READABILITY ----------\ntime_complexity: O((V+E)*log(V)),\nspace_complexity: O(V),\nexplanation: The time complexity of Dijkstra's algorithm is determined by the number of vertices (V) and edges (E). Since a priority queue (min-heap in this case, implemented with heapq module) needs to be maintained for each vertex visited except start node and extracting an element from it takes O(log V) time. Every edge has weight 1 or less ensuring that all nodes will eventually get popped out of the min-heap after a finite number of iterations (up to E times). Hence, we have at most two nested loops: one over edges and another on vertices which gives us complexity O(E + V log V) but this can be further optimized as Dijkstra's algorithm with Fibonacci heap reduces the time taken by half for edge weights upto 15. But here it is considered to have simple min-heap operations so, final time_complexity will be O((V+E)*log(V)).\nThe space complexity comes from storing distances and maintaining priority queue at most containing V elements (one distance entry per vertex), hence the space complexity becomes linear with respect to number of vertices i.e., O(V). The input graph is represented using an adjacency list representation which requires additional memory for each edge, but as all weights are 1 or less here it doesn't add significant overhead and we only need V extra spaces in worst case scenario (when every node needs to store distance value from start), hence space complexity becomes O(V).\nefficiency_score: 7\n\n---------- COMPOSITE SCORE FOR YOUR CODE ----------\n7.21\n\n--------------------------------------------\n"
}