{
  "meta": {
    "analysis_id": "e349241b-74e7-4d6b-8c27-4361db60ca1d",
    "timestamp": "2025-12-29T10:16:07.024525",
    "category": "Stack",
    "topic": "Implement stack (array or linked list based)"
  },
  "scores": {
    "pylint_score": 10.0,
    "complexity_score": 8.0,
    "loc_score": 10.0,
    "structural_score": 5.0,
    "logic_score": 8.0,
    "cyclomatic_score": 9.0,
    "mi_score": 6.41,
    "composite_score": 8.42
  },
  "raw_outputs": {
    "pylint": "--------------------------------------------------------------------\nYour code has been rated at 10.00/10 (previous run: 10.00/10, +0.00)",
    "ast": [
      "Variable `calculate_factorial_iterative` used before assignment (line 13).",
      "Variable `n` used before assignment (line 2).",
      "Variable `n` used before assignment (line 4).",
      "Variable `i` used before assignment (line 9).",
      "Variable `n` used before assignment (line 8)."
    ],
    "math_llm": "No mathematical issues found or the model returned an empty response.",
    "complexity_llm": "time_complexity: O(n),\nspace_complexity: O(1),\nexplanation: The time complexity, denoted as O(n), arises from the loop that calculates the factorial iteratively. In this case, each iteration of the for-loop results in a constant amount of work (multiplication operation). Since n iterations are performed at most when calculating the factorial, it is said to run linearly with respect to the input size \\(n\\). The space complexity is O(1), which indicates that the memory usage does not increase with an increasing value of \\(n\\); only a fixed amount of space (to store variables such as `factorial` and loop indices) are required, regardless of how large `n` gets.\nefficiency_score: 8"
  },
  "final_report": "\nCODE ANALYSIS REPORT\n-----------------------------------------------\nLINES OF CODE: 13\nFunctions: 1\nClasses: 0\n\nScore: 10/10\n\n---------- STRUCTURAL ERRORS (AST) ----------\nVariable `calculate_factorial_iterative` used before assignment (line 13).\nVariable `n` used before assignment (line 2).\nVariable `n` used before assignment (line 4).\nVariable `i` used before assignment (line 9).\nVariable `n` used before assignment (line 8).\n\nScore: 5.0/10\n\n---------- PYLINT ----------\n--------------------------------------------------------------------\nYour code has been rated at 10.00/10 (previous run: 10.00/10, +0.00)\n\nScore: 10.0/10\n\n---------- CYCLOMATIC COMPLEXITY ----------\nGrade: A\nScore: 4.0\nRemarks: CC Range (1-5): Very simple and clear.\n\n---------- MAINTAINABILITY INDEX ----------\nGrade: A\nScore: 64.1\nRemarks: MI Range (65-100): Highly maintainable \u2014 clean and simple\n\n---------- MATHEMATICAL / ALGORITHMIC ERRORS (LLM) ----------\nNo mathematical issues found or the model returned an empty response.\n\n---------- TIME/SPACE COMPLEXITY & READABILITY ----------\ntime_complexity: O(n),\nspace_complexity: O(1),\nexplanation: The time complexity, denoted as O(n), arises from the loop that calculates the factorial iteratively. In this case, each iteration of the for-loop results in a constant amount of work (multiplication operation). Since n iterations are performed at most when calculating the factorial, it is said to run linearly with respect to the input size \\(n\\). The space complexity is O(1), which indicates that the memory usage does not increase with an increasing value of \\(n\\); only a fixed amount of space (to store variables such as `factorial` and loop indices) are required, regardless of how large `n` gets.\nefficiency_score: 8\n\n---------- COMPOSITE SCORE FOR YOUR CODE ----------\n8.42\n\n--------------------------------------------\n"
}